<?xml version="1.0" encoding="UTF-8"?>
<!DOCTYPE categories SYSTEM "categories.dtd">

<categories>
  <category>
    <name>new Cat</name>
    <description />
    <color red="75" green="255" blue="75" />
  </category>
  <category>
    <name>sommarlov</name>
    <description>Ledig tid tills jobbet b√∂rjar!!!</description>
    <color red="75" green="195" blue="135" />
  </category>
</categories>

